{
  "authorityType": "composition-authority.v1",
  "authorityId": "app-lab-email-password-entry.v1",
  "authorityKind": "authentication-entry",
  "label": "App Lab email and password entry",
  "reviewStatus": "reviewed-candidate",
  "evidenceClass": "observed-and-reviewed",
  "source": {
    "documentId": "34e5a5c1b6a55eecdb815426b261e3646fa3b0567262762c7e9a67f66bb60d56",
    "rootId": "intelligence-05",
    "relativePath": "app-lab/experiment/lab/sketch2html/output.html",
    "sourceReferenceIds": ["app-lab/experiment/lab/sketch2html/output.html:0:2385"]
  },
  "provides": ["role.identity-entry", "role.primary-authentication-action", "state.busy", "state.confirmation", "state.failure"],
  "requires": ["slot.authentication-entry", "content.failure-message"],
  "conflictsWith": [],
  "bindings": [
    { "key": "auth.method", "value": "email-password" },
    { "key": "auth.identity-label", "value": "Email" },
    { "key": "auth.secret-label", "value": "Password" },
    { "key": "auth.primary-action-label", "value": "Sign in" }
  ]
}
